{
  "$schema": "https://json-schema.org/draft/2020-12/schema",
  "$id": "jamf-inventory-visit.schema.json",
  "type": "object",
  "additionalProperties": false,
  "required": [
    "keys",
    "schema",
    "source",
    "watch_id",
    "checked_at",
    "ok",
    "status",
    "headline",
    "coverage",
    "baseline_ref",
    "vs_prior",
    "computers",
    "unchanged",
    "live_id",
    "removed",
    "notes",
    "scope"
  ],
  "properties": {
    "keys": {
      "type": "array",
      "items": { "$ref": "#/$defs/tag" }
    },
    "schema": { "const": "jamf-inventory/v1" },
    "source": { "const": "jamf" },
    "watch_id": { "type": "string", "pattern": "^[0-9]{4}-[0-9]{2}-[0-9]{2}T[0-9]{2}-[0-9]{2}-[0-9]{2}Z$" },
    "checked_at": { "type": "string", "minLength": 20 },
    "ok": { "type": "boolean" },
    "status": { "enum": ["ok", "degraded", "unknown"] },
    "headline": { "type": "string", "maxLength": 400 },
    "coverage": { "enum": ["complete", "partial"] },
    "baseline_ref": { "type": ["string", "null"], "pattern": "^jamf/[0-9]{4}-.+$" },
    "vs_prior": { "$ref": "#/$defs/vs_prior" },
    "computers": {
      "type": "array",
      "items": { "$ref": "#/$defs/computer" }
    },
    "unchanged": { "type": "integer", "minimum": 0 },
    "live_id": { "type": ["string", "null"] },
    "removed": {
      "type": "array",
      "items": { "$ref": "#/$defs/removed" }
    },
    "notes": { "type": "string", "maxLength": 200 },
    "scope": { "type": ["string", "null"] }
  },
  "$defs": {
    "tag": {
      "type": "string",
      "pattern": "^(device|site|warehouse|request):[^ ].*$"
    },
    "vs_prior": {
      "type": "object",
      "additionalProperties": false,
      "required": ["prior_watch_id", "delta", "changed"],
      "properties": {
        "prior_watch_id": { "type": ["string", "null"] },
        "delta": { "enum": ["first", "changed"] },
        "changed": {
          "type": "array",
          "maxItems": 40,
          "items": {
            "type": "object",
            "additionalProperties": false,
            "required": ["id", "field", "prior", "current"],
            "properties": {
              "id": { "type": "string" },
              "field": { "type": "string" },
              "prior": { "type": "string" },
              "current": { "type": "string" }
            }
          }
        }
      }
    },
    "computer": {
      "type": "object",
      "additionalProperties": false,
      "required": [
        "keys",
        "id",
        "name",
        "serial",
        "model",
        "os",
        "os_version",
        "user",
        "site",
        "last_contact",
        "last_ip",
        "managed",
        "supervised",
        "user_approved_mdm",
        "mdm_capable",
        "filevault",
        "sip",
        "firewall",
        "severity",
        "findings",
        "note"
      ],
      "properties": {
        "keys": { "type": "array", "items": { "$ref": "#/$defs/tag" } },
        "id": { "type": "string", "minLength": 1 },
        "name": { "type": "string" },
        "serial": { "type": ["string", "null"] },
        "model": { "type": ["string", "null"] },
        "os": { "type": ["string", "null"] },
        "os_version": { "type": ["string", "null"] },
        "user": { "type": ["string", "null"] },
        "site": { "type": ["string", "null"] },
        "last_contact": { "type": ["string", "null"] },
        "last_ip": { "type": ["string", "null"] },
        "managed": { "type": ["boolean", "null"] },
        "supervised": { "type": ["boolean", "null"] },
        "user_approved_mdm": { "type": ["boolean", "null"] },
        "mdm_capable": { "type": ["boolean", "null"] },
        "filevault": { "type": ["string", "null"] },
        "sip": { "type": ["string", "null"] },
        "firewall": { "type": ["boolean", "null"] },
        "severity": { "type": ["string", "null"] },
        "findings": {
          "type": "array",
          "maxItems": 5,
          "items": { "type": "string", "maxLength": 160 }
        },
        "note": { "type": "string", "maxLength": 200 }
      }
    },
    "removed": {
      "type": "object",
      "additionalProperties": false,
      "required": ["id", "serial", "keys"],
      "properties": {
        "id": { "type": "string" },
        "serial": { "type": ["string", "null"] },
        "keys": { "type": "array", "items": { "$ref": "#/$defs/tag" } }
      }
    }
  }
}
