{
  "keys": ["device:SERIAL123456", "site:ExampleCity"],
  "schema": "jamf-inventory/v1",
  "source": "jamf",
  "watch_id": "2026-01-01T00-00-00Z",
  "checked_at": "2026-01-01T00:00:00Z",
  "ok": true,
  "status": "ok",
  "headline": "SERIAL123456 mac-example id 100 managed. Stub id 101 has not checked in.",
  "coverage": "complete",
  "baseline_ref": null,
  "vs_prior": {
    "prior_watch_id": null,
    "delta": "first",
    "changed": []
  },
  "computers": [
    {
      "keys": ["device:SERIAL123456", "site:ExampleCity"],
      "id": "100",
      "name": "mac-example",
      "serial": "SERIAL123456",
      "model": "Mac mini",
      "os": "macOS",
      "os_version": "15.0",
      "user": "user.name",
      "site": "ExampleCity",
      "last_contact": "2026-01-01T00:00:00Z",
      "last_ip": null,
      "managed": true,
      "supervised": false,
      "user_approved_mdm": false,
      "mdm_capable": false,
      "filevault": "SOME_ENCRYPTED",
      "sip": "ENABLED",
      "firewall": false,
      "severity": "ok",
      "findings": [],
      "note": "Baseline."
    },
    {
      "keys": ["device:SERIAL123456", "site:ExampleCity"],
      "id": "101",
      "name": "SERIAL123456",
      "serial": "SERIAL123456",
      "model": "Mac mini",
      "os": null,
      "os_version": null,
      "user": null,
      "site": "ExampleCity",
      "last_contact": null,
      "last_ip": null,
      "managed": false,
      "supervised": true,
      "user_approved_mdm": false,
      "mdm_capable": true,
      "filevault": "NOT_APPLICABLE",
      "sip": null,
      "firewall": null,
      "severity": null,
      "findings": [],
      "note": "Baseline."
    }
  ],
  "unchanged": 0,
  "live_id": "100",
  "removed": [],
  "notes": "Baseline.",
  "scope": "SERIAL123456"
}
